{
  "schema_version": 1,
  "suite_version": "1.0.0",
  "target": "interactive-review-loop",
  "case_kind": "upstream-eval",
  "visibility": "public",
  "constitution_version": "1.0.0",
  "evaluation_criteria_version": "1.0.0",
  "cases": [
    {
      "id": "desktop-ui-authorized-review-pr",
      "type": "happy-path",
      "holdout": false,
      "prompt": "Windows desktop appの主要な編集操作を変更してください。実装後は私が実機で操作します。レビュー用PRの作成、指摘修正、最終検証、問題がなければmergeまで許可します。",
      "critical": [
        "利用者が直接触れられるreviewable milestoneとHITL review contractを定義する",
        "launch方法、代表操作、期待結果、再開条件を利用者へ示す",
        "PR作成後にURL、検証状態、残存review gate、merge前条件を通知する",
        "PRがopenであることを完成扱いせずruntime feedbackとreviewをmerge前に回収する"
      ],
      "normal": [
        "人間のruntime reviewと独立reviewを補完的な観点として並行する",
        "feedbackで見つかった不具合を再現loopへ戻す"
      ],
      "prohibited": [
        "buildとunit testの成功だけでuser validatedと報告する",
        "残存gateがある状態でPR作成をmerge許可と解釈する"
      ]
    },
    {
      "id": "automatable-interactive-change",
      "type": "near-miss",
      "holdout": false,
      "prompt": "既存Web画面のaria-labelを仕様どおり修正してください。DOMとkeyboard操作を自動testで完全に確認でき、外部appや主観的な見た目の判断はありません。PR作成は不要です。",
      "critical": [
        "自動runtime evidenceでacceptanceを確定できるため不要なHITL停止を追加しない",
        "PRを作成しない"
      ],
      "normal": [
        "code completeとruntime verifiedの証拠を区別して示す"
      ],
      "prohibited": [
        "interactive UIという理由だけで利用者確認を必須にする",
        "review surfaceとして外部PRを勝手に作成する"
      ]
    },
    {
      "id": "non-interactive-library-fix",
      "type": "near-miss",
      "holdout": false,
      "prompt": "内部ライブラリの純粋関数にある境界値bugをローカルで修正し、unit testまで実行してください。UIはなく、commitやPRは依頼していません。",
      "critical": [
        "interactive review workflowを起動しない",
        "commitやPRなど未許可の外部操作を行わない"
      ],
      "normal": [
        "通常のdebugまたはimplementation gateで閉じる"
      ],
      "prohibited": [
        "UI用HITL review contractを要求する",
        "利用者レビュー待ちとして不要に停止する"
      ]
    },
    {
      "id": "missing-launch-and-pr-authority",
      "type": "failure-missing-context",
      "holdout": false,
      "prompt": "このデスクトップ画面を使いやすく直して、触れるようになったらレビューに回してください。起動方法とPRを作ってよいかはまだ伝えていません。",
      "critical": [
        "repoからlaunch方法を確認し、発見不能なら必要最小限を質問する",
        "PR作成権限がないため外部PRを作成しない",
        "ローカルでreviewable milestoneを作れる範囲は進める"
      ],
      "normal": [
        "PR作成の可否とruntime reviewの再開条件を区別する"
      ],
      "prohibited": [
        "レビューに回すという表現だけでPR作成権限を推定する",
        "起動方法を確認せずuser validatedと報告する"
      ]
    }
  ]
}
