{
  "schema_version": 1,
  "suite_version": "1.0.0",
  "target": "to-prd-purpose",
  "case_kind": "upstream-eval",
  "visibility": "public",
  "constitution_version": "1.0.0",
  "evaluation_criteria_version": "1.0.0",
  "cases": [
    {
      "id": "to-prd-purpose-confirmed-001",
      "type": "happy-path",
      "holdout": false,
      "prompt": "合意済みメモをPRDにして保存してください。Source A（窓口担当の観察）：担当者が共有表を同時に編集すると同じ問合せを二人で処理する。引継ぎ担当は未割当の問合せを見落とす。Source B（責任者との合意）：今回の上位目的は問合せを確実に引き継げること。そのために二重対応と未割当の見落としを防ぐ。二人が同じ未割当の問合せを引き受けても担当として確定するのは一人だけで、もう一人には担当が決まったことを知らせる。担当者は未割当だけを一覧できる。通知メールと過去データ移行は対象外。現在は社内ブラウザ利用だけを扱う。案件番号は021。設計方式は未検討です。",
      "critical": [
        "文脈、上位目的、二つの関連する下位目的を、機能や手段と区別して整理する",
        "担当確定・他方への通知と未割当一覧を、各目的を満たす条件として要件化する",
        "すべての採用要件について目的と観測可能なACの対応を追えるようにする。ID自体は必須ではない",
        "Source Aの観察とSource Bの合意を区別し、採用目的・要件の根拠を追えるようにする"
      ],
      "normal": [
        "docs/prd/021_PRD.mdを保存し、既知の成果物pathをhandoffに含める",
        "通知メール・移行を対象外に保ち、構造判断の次工程を示す"
      ],
      "prohibited": [
        "ロック方式、DB、API、module構成を新しく決める",
        "成功率や応答時間の数値目標を発明する"
      ]
    },
    {
      "id": "to-prd-purpose-unknown-001",
      "type": "failure-missing-context",
      "holdout": false,
      "prompt": "集計業務のPRDを未確定のまま草案として保存してください。今回は追加質問せずUnknownsへ整理してください。経理担当は締め後の集計を早くしたいと言っていますが、現状の所要時間、対象データ量、達成とみなす時間はまだ調べていません。自動集計を使う案は出ていますが採用されていません。給与計算は対象外で合意しています。案件番号は022。",
      "critical": [
        "集計を早く終えたいという目的と、未合意の自動集計案を区別する",
        "測定条件と達成閾値をUnknownsとし、数値や自動集計の採用を確定しない",
        "目的に対する要件・ACが未確定であることと、実装へ渡せない理由を明示する",
        "依頼どおり草案の保存まで進め、不足だけを理由に質問への返答待ちで停止しない"
      ],
      "normal": [
        "不足を解消するための戻り先を示す",
        "給与計算の対象外を保持する"
      ],
      "prohibited": [
        "根拠のない目標値・業務ルール・採用機能を決定事項にする",
        "Unknownsを残したまま実装可能または確定済みと宣言する"
      ]
    },
    {
      "id": "to-prd-purpose-gap-001",
      "type": "failure-missing-context",
      "holdout": false,
      "prompt": "注文取消のPRD草案を保存してください。合意済み事項：窓口担当が誤受付を取り消して後続の誤作業を防ぐ。未出荷の注文は取り消せ、取消後に通常の出荷対象へ含めない。返品と返金は対象外。Pythonを使うことは社内方針として決定済み。モデリング担当から『出荷手配済みだが未出荷の注文も取消可能か不明』というrequirement gapが戻ってきました。会議中にはOrder集約、CancelService、イベント方式も候補に挙がりましたが採否は未決です。追加質問は後で行うので、今分かることをまとめてください。案件番号は023。",
      "critical": [
        "誤作業を防ぐ目的から取消条件・取消後の出荷除外という要件へ接続する",
        "合意済み範囲の要件とその外部から観測できるACを対応づける",
        "手配済み未出荷の扱いを元の取消要件に関係するblocking Unknownとして残し、勝手に許可・禁止を決めない",
        "Pythonだけを既決の技術制約として保持し、未決のモデルや構造案を正式要件にしない"
      ],
      "normal": [
        "gapの確認後にPRDへ反映する戻り先・次工程を説明する",
        "保存済みPRDを草案と明記し、成果物pathを示す"
      ],
      "prohibited": [
        "Order集約、CancelService、イベント方式を採用する",
        "出荷手配済みの取消可否や返金条件を新しく決める"
      ]
    },
    {
      "id": "to-prd-purpose-small-001",
      "type": "happy-path",
      "holdout": false,
      "prompt": "小さな画面文言変更のPRDを会話だけで整理してください。文書保存は不要です。対象は社内ツールの一画面だけです。初回利用者が次に進む操作だと理解できるよう、ボタン名を『実行』から『次へ』へ変えることで合意しました。クリック後の動作、他画面の文言、配置は変更しません。設計や実装はまだ始めないでください。",
      "critical": [
        "初回利用者の理解という目的、文言変更という要件、対象画面の表示確認というACを追える形で区別する",
        "合意済みの文言と対象外を保持し、新しい使いやすさの数値基準を作らない",
        "会話のみという指定に従い、文書保存や設計・実装を始めない"
      ],
      "normal": [
        "小規模変更に不要なID表、下位目的の階層、モデル工程を強制せず簡潔に示す",
        "conversation-onlyのexception reasonを示す"
      ],
      "prohibited": [
        "PRD、ADR、domain modelのファイルを作る",
        "文言変更だけで利用者の理解向上まで実証済みと扱う"
      ]
    },
    {
      "id": "to-prd-purpose-design-only-001",
      "type": "near-miss",
      "holdout": false,
      "prompt": "目的・要件・ACは別途合意済みです。今回はPRDを作り直さず、既存バッチのmodule責務、public interface、data flowを設計するための次の進め方だけを教えてください。実装はまだしません。",
      "critical": [
        "PRDの再作成に進まず、technical-designの担当範囲だと判断する",
        "目的・要件・ACを再決定せず、合意済み入力として扱う",
        "実装を開始しない"
      ],
      "normal": [
        "既存構造と合意済み入力を確認する簡潔なhandoffを示す"
      ],
      "prohibited": [
        "PRDや新しい要求を生成する",
        "依頼されていないインタビューやモデル作成を必須にする"
      ]
    }
  ]
}
